{
  "config_version": "2.0.0",
  "metadata": {
    "name": "desktop",
    "display_name": "desktop",
    "description": ""
  },
  "source": {
    "type": "github",
    "owner": "zen-browser",
    "repo": "desktop",
    "prerelease": false
  },
  "appimage": {
    "naming": {
      "template": "zen-{characteristic_suffix}.AppImage",
      "target_name": "zen-browser",
      "architectures": [
        "amd64",
        "x86_64"
      ]
    }
  },
  "verification": {
    "method": "digest"
  },
  "icon": {
    "method": "extraction",
    "filename": "zen-browser.svg",
    "download_url": "https://raw.githubusercontent.com/zen-browser/desktop/dev/docs/assets/zen-black.svg"
  }
}
