{
  "config_version": "2.0.0",
  "metadata": {
    "name": "joplin",
    "display_name": "joplin",
    "description": ""
  },
  "source": {
    "type": "github",
    "owner": "laurent22",
    "repo": "joplin",
    "prerelease": false
  },
  "appimage": {
    "naming": {
      "template": "{rename}-{latest_version}.AppImage",
      "target_name": "joplin",
      "architectures": [
        "amd64",
        "x86_64"
      ]
    }
  },
  "verification": {
    "method": "digest"
  },
  "icon": {
    "method": "extraction",
    "filename": "joplin.png",
    "download_url": "https://raw.githubusercontent.com/laurent22/joplin/dev/Assets/LinuxIcons/256x256.png"
  }
}
