{
  "config_version": "2.0.0",
  "metadata": {
    "name": "KDiskMark",
    "display_name": "KDiskMark",
    "description": ""
  },
  "source": {
    "type": "github",
    "owner": "JonMagon",
    "repo": "KDiskMark",
    "prerelease": false
  },
  "appimage": {
    "naming": {
      "template": "kdiskmark-{characteristic_suffix}.AppImage",
      "target_name": "kdiskmark",
      "architectures": [
        "amd64",
        "x86_64"
      ]
    }
  },
  "verification": {
    "method": "digest"
  },
  "icon": {
    "method": "extraction",
    "filename": "kdiskmark.png",
    "download_url": "https://raw.githubusercontent.com/JonMagon/KDiskMark/master/data/icons/128-apps-kdiskmark.png"
  }
}
